{
 "version": 1,
 "label": "texo-384/encoder",
 "recordedLabel": "texo-encoder",
 "layout": "nchw",
 "constantsBlob": "texo-encoder.bin",
 "provenance": {
  "summary": "Texo's HGNetv2 encoder (4 stages, hidden 2048) as one NCHW WebNN graph, plus the decoder's cross-attention K/V for both layers computed here once per image: enc_to_dec_proj and k/v_proj folded into one 2048->384 projection each, emitted as 1x1 convs on the final [1,2048,12,12] map whose output reshapes for free into K^T per head.",
  "source": {
   "model": "Texo / FormulaNet as shipped in LatexGen public/models/texo (fp32 ONNX: encoder_model.onnx, decoder_model_merged.onnx)",
   "encoder_sha256": "95cccef463e5ed3623282f1541c0011a00b8a5d0828ea2cd57d6953ad4310b5b",
   "decoder_sha256": "10be29b751f6de5f9900c3658551020dc865257eb2c3034bc4c1e016e4d0e35d",
   "precision": "float16 throughout; no float32 ops",
   "weightsExport": "bench/webnn/texo/export_texo.py (weights.bin sha256 0e146e4ccf63d3606d4d6c40df8a2d82dc6e59cc3f08876e38159d771ecbb8ac)"
  },
  "recordedFrom": {
   "repo": "webnn-workbench",
   "commit": "233e460",
   "recorder": "bench/webnn/ir-record.js (Proxy around MLGraphBuilder; shapes are the backend's)",
   "label": "texo-encoder",
   "harness": "node bench/webnn/texo/run-texo.mjs --dump-ir encoder=texo-encoder",
   "recordedAt": "2026-09-05",
   "constantBytes": 33354432
  },
  "folds": [
   "input channels 3 -> 1 (identical channels summed into stem1)",
   "stem dynamic pads as constant pads (0,0,1,1) at 384x384",
   "BatchNorm already folded into conv biases by the ONNX export",
   "enc_to_dec_proj o k_proj / v_proj -> one 2048x384 weight per layer per side",
   "cross-attention K emitted transposed ([1,16,24,144]) straight from the 1x1 conv output"
  ]
 },
 "emitterConfig": {
  "stats": {
   "ops": 324,
   "mathOps": 155,
   "opHisto": {
    "constant": 168,
    "conv2d": 84,
    "relu": 53,
    "concat": 7,
    "reshape": 4,
    "pad": 2,
    "add": 2,
    "transpose": 2,
    "input": 1,
    "maxPool2d": 1
   },
   "fusions": {
    "inputChannelsFolded": true,
    "normalizationFolded": false,
    "crossAttnKVHoisted": true,
    "encToDecProjFoldedIntoKV": true,
    "batchNormFolded": "already in the ONNX export",
    "layout": "nchw"
   }
  }
 },
 "note": "One operand namespace: graph inputs keep their names, constants are k<N>, op results v<N>. Multi-output ops (split) list every result in `outputs`.",
 "inputs": [
  {
   "name": "image",
   "dataType": "float16",
   "shape": [
    1,
    1,
    384,
    384
   ]
  }
 ],
 "outputs": [
  {
   "name": "enc_kT0",
   "operand": "v146",
   "dataType": "float16",
   "shape": [
    1,
    16,
    24,
    144
   ],
   "role": "cross-attention K^T, layer 0, per head"
  },
  {
   "name": "enc_v0",
   "operand": "v149",
   "dataType": "float16",
   "shape": [
    1,
    16,
    144,
    24
   ],
   "role": "cross-attention V, layer 0, per head"
  },
  {
   "name": "enc_kT1",
   "operand": "v151",
   "dataType": "float16",
   "shape": [
    1,
    16,
    24,
    144
   ],
   "role": "cross-attention K^T, layer 1"
  },
  {
   "name": "enc_v1",
   "operand": "v154",
   "dataType": "float16",
   "shape": [
    1,
    16,
    144,
    24
   ],
   "role": "cross-attention V, layer 1"
  }
 ],
 "constants": {
  "k0": {
   "dataType": "float16",
   "shape": [
    32,
    1,
    3,
    3
   ],
   "byteOffset": 0,
   "byteLength": 576,
   "tag": "stem.stem1"
  },
  "k1": {
   "dataType": "float16",
   "shape": [
    32
   ],
   "byteOffset": 576,
   "byteLength": 64,
   "tag": "stem.stem1"
  },
  "k2": {
   "dataType": "float16",
   "shape": [
    16,
    32,
    2,
    2
   ],
   "byteOffset": 640,
   "byteLength": 4096,
   "tag": "stem.stem2a"
  },
  "k3": {
   "dataType": "float16",
   "shape": [
    16
   ],
   "byteOffset": 4736,
   "byteLength": 32,
   "tag": "stem.stem2a"
  },
  "k4": {
   "dataType": "float16",
   "shape": [
    32,
    16,
    2,
    2
   ],
   "byteOffset": 4768,
   "byteLength": 4096,
   "tag": "stem.stem2b"
  },
  "k5": {
   "dataType": "float16",
   "shape": [
    32
   ],
   "byteOffset": 8864,
   "byteLength": 64,
   "tag": "stem.stem2b"
  },
  "k6": {
   "dataType": "float16",
   "shape": [
    32,
    64,
    3,
    3
   ],
   "byteOffset": 8928,
   "byteLength": 36864,
   "tag": "stem.stem3"
  },
  "k7": {
   "dataType": "float16",
   "shape": [
    32
   ],
   "byteOffset": 45792,
   "byteLength": 64,
   "tag": "stem.stem3"
  },
  "k8": {
   "dataType": "float16",
   "shape": [
    48,
    32,
    1,
    1
   ],
   "byteOffset": 45856,
   "byteLength": 3072,
   "tag": "stem.stem4"
  },
  "k9": {
   "dataType": "float16",
   "shape": [
    48
   ],
   "byteOffset": 48928,
   "byteLength": 96,
   "tag": "stem.stem4"
  },
  "k10": {
   "dataType": "float16",
   "shape": [
    48,
    48,
    3,
    3
   ],
   "byteOffset": 49024,
   "byteLength": 41472,
   "tag": "stages.0.blocks.0.layers.0"
  },
  "k11": {
   "dataType": "float16",
   "shape": [
    48
   ],
   "byteOffset": 90496,
   "byteLength": 96,
   "tag": "stages.0.blocks.0.layers.0"
  },
  "k12": {
   "dataType": "float16",
   "shape": [
    48,
    48,
    3,
    3
   ],
   "byteOffset": 90592,
   "byteLength": 41472,
   "tag": "stages.0.blocks.0.layers.1"
  },
  "k13": {
   "dataType": "float16",
   "shape": [
    48
   ],
   "byteOffset": 132064,
   "byteLength": 96,
   "tag": "stages.0.blocks.0.layers.1"
  },
  "k14": {
   "dataType": "float16",
   "shape": [
    48,
    48,
    3,
    3
   ],
   "byteOffset": 132160,
   "byteLength": 41472,
   "tag": "stages.0.blocks.0.layers.2"
  },
  "k15": {
   "dataType": "float16",
   "shape": [
    48
   ],
   "byteOffset": 173632,
   "byteLength": 96,
   "tag": "stages.0.blocks.0.layers.2"
  },
  "k16": {
   "dataType": "float16",
   "shape": [
    48,
    48,
    3,
    3
   ],
   "byteOffset": 173728,
   "byteLength": 41472,
   "tag": "stages.0.blocks.0.layers.3"
  },
  "k17": {
   "dataType": "float16",
   "shape": [
    48
   ],
   "byteOffset": 215200,
   "byteLength": 96,
   "tag": "stages.0.blocks.0.layers.3"
  },
  "k18": {
   "dataType": "float16",
   "shape": [
    48,
    48,
    3,
    3
   ],
   "byteOffset": 215296,
   "byteLength": 41472,
   "tag": "stages.0.blocks.0.layers.4"
  },
  "k19": {
   "dataType": "float16",
   "shape": [
    48
   ],
   "byteOffset": 256768,
   "byteLength": 96,
   "tag": "stages.0.blocks.0.layers.4"
  },
  "k20": {
   "dataType": "float16",
   "shape": [
    48,
    48,
    3,
    3
   ],
   "byteOffset": 256864,
   "byteLength": 41472,
   "tag": "stages.0.blocks.0.layers.5"
  },
  "k21": {
   "dataType": "float16",
   "shape": [
    48
   ],
   "byteOffset": 298336,
   "byteLength": 96,
   "tag": "stages.0.blocks.0.layers.5"
  },
  "k22": {
   "dataType": "float16",
   "shape": [
    64,
    336,
    1,
    1
   ],
   "byteOffset": 298432,
   "byteLength": 43008,
   "tag": "stages.0.blocks.0.aggregation"
  },
  "k23": {
   "dataType": "float16",
   "shape": [
    64
   ],
   "byteOffset": 341440,
   "byteLength": 128,
   "tag": "stages.0.blocks.0.aggregation"
  },
  "k24": {
   "dataType": "float16",
   "shape": [
    128,
    64,
    1,
    1
   ],
   "byteOffset": 341568,
   "byteLength": 16384,
   "tag": "stages.0.blocks.0.aggregation"
  },
  "k25": {
   "dataType": "float16",
   "shape": [
    128
   ],
   "byteOffset": 357952,
   "byteLength": 256,
   "tag": "stages.0.blocks.0.aggregation"
  },
  "k26": {
   "dataType": "float16",
   "shape": [
    128,
    1,
    3,
    3
   ],
   "byteOffset": 358208,
   "byteLength": 2304,
   "tag": "stages.1.downsample"
  },
  "k27": {
   "dataType": "float16",
   "shape": [
    128
   ],
   "byteOffset": 360512,
   "byteLength": 256,
   "tag": "stages.1.downsample"
  },
  "k28": {
   "dataType": "float16",
   "shape": [
    96,
    128,
    3,
    3
   ],
   "byteOffset": 360768,
   "byteLength": 221184,
   "tag": "stages.1.blocks.0.layers.0"
  },
  "k29": {
   "dataType": "float16",
   "shape": [
    96
   ],
   "byteOffset": 581952,
   "byteLength": 192,
   "tag": "stages.1.blocks.0.layers.0"
  },
  "k30": {
   "dataType": "float16",
   "shape": [
    96,
    96,
    3,
    3
   ],
   "byteOffset": 582144,
   "byteLength": 165888,
   "tag": "stages.1.blocks.0.layers.1"
  },
  "k31": {
   "dataType": "float16",
   "shape": [
    96
   ],
   "byteOffset": 748032,
   "byteLength": 192,
   "tag": "stages.1.blocks.0.layers.1"
  },
  "k32": {
   "dataType": "float16",
   "shape": [
    96,
    96,
    3,
    3
   ],
   "byteOffset": 748224,
   "byteLength": 165888,
   "tag": "stages.1.blocks.0.layers.2"
  },
  "k33": {
   "dataType": "float16",
   "shape": [
    96
   ],
   "byteOffset": 914112,
   "byteLength": 192,
   "tag": "stages.1.blocks.0.layers.2"
  },
  "k34": {
   "dataType": "float16",
   "shape": [
    96,
    96,
    3,
    3
   ],
   "byteOffset": 914304,
   "byteLength": 165888,
   "tag": "stages.1.blocks.0.layers.3"
  },
  "k35": {
   "dataType": "float16",
   "shape": [
    96
   ],
   "byteOffset": 1080192,
   "byteLength": 192,
   "tag": "stages.1.blocks.0.layers.3"
  },
  "k36": {
   "dataType": "float16",
   "shape": [
    96,
    96,
    3,
    3
   ],
   "byteOffset": 1080384,
   "byteLength": 165888,
   "tag": "stages.1.blocks.0.layers.4"
  },
  "k37": {
   "dataType": "float16",
   "shape": [
    96
   ],
   "byteOffset": 1246272,
   "byteLength": 192,
   "tag": "stages.1.blocks.0.layers.4"
  },
  "k38": {
   "dataType": "float16",
   "shape": [
    96,
    96,
    3,
    3
   ],
   "byteOffset": 1246464,
   "byteLength": 165888,
   "tag": "stages.1.blocks.0.layers.5"
  },
  "k39": {
   "dataType": "float16",
   "shape": [
    96
   ],
   "byteOffset": 1412352,
   "byteLength": 192,
   "tag": "stages.1.blocks.0.layers.5"
  },
  "k40": {
   "dataType": "float16",
   "shape": [
    256,
    704,
    1,
    1
   ],
   "byteOffset": 1412544,
   "byteLength": 360448,
   "tag": "stages.1.blocks.0.aggregation"
  },
  "k41": {
   "dataType": "float16",